{
  "$schema": "https://json-schema.org/draft/2020-12/schema",
  "title": "data/site.json: lo general de la web",
  "description": "data/site.json: el nombre, el dominio, el color, el contacto y qué proyectos salen, en qué orden. VS Code lee este fichero (por el \"$schema\" de arriba del JSON) para autocompletar, explicar cada campo y subrayar lo que está mal; el build y la vista previa lo usan para revisar.",
  "type": "object",
  "required": [
    "title",
    "lists"
  ],
  "additionalProperties": false,
  "properties": {
    "$schema": {
      "type": "string"
    },
    "_": {
      "type": "string"
    },
    "title": {
      "type": "string",
      "description": "El nombre de la web: sale en la pestaña y en Google."
    },
    "url": {
      "type": [
        "string",
        "null"
      ],
      "pattern": "^https://[^/]+$",
      "description": "El dominio, sin barra al final: \"https://www.mokakopa.com\". Sin dominio, null (y Google no la indexa)."
    },
    "color": {
      "type": "string",
      "pattern": "^#[0-9A-Fa-f]{6}$",
      "description": "El color de resaltado: \"#FF69B4\""
    },
    "email": {
      "type": "string",
      "pattern": "^[^@\\s]+@[^@\\s]+\\.[^@\\s]+$",
      "description": "El correo del contacto."
    },
    "social": {
      "type": "object",
      "additionalProperties": false,
      "properties": {
        "instagram": {
          "type": "string",
          "pattern": "^[^@\\s/]+$",
          "description": "El usuario, sin @: \"mokakopa\""
        }
      }
    },
    "lists": {
      "type": "object",
      "description": "Los proyectos que salen, en orden. Para quitar uno de la web, se quita de la lista (la carpeta se puede quedar).",
      "additionalProperties": {
        "type": "object",
        "required": [
          "projects"
        ],
        "additionalProperties": false,
        "properties": {
          "projects": {
            "type": "array",
            "items": {
              "type": "string",
              "pattern": "^[A-Za-z0-9-]+$",
              "description": "El nombre de la carpeta en projects/: letras sin acentos, números y guiones."
            },
            "description": "Los nombres de las carpetas de projects/, en el orden de la web."
          }
        }
      }
    }
  }
}
